cbtt,station_id,Name,Basin
ALNO,14030000,"ALLEN CN AT ECHO, OR",Umatilla
ALTO,14029800,"US ""A"" LINE CN NR HERMISTON, OR",Umatilla
ANTO,14348080,"ANTELOPE CR BL ROGUE RIVER VALLEY IRR. DIST. DIV. NR WHITE CITY, OR",Rogue
ARNO,14065500,"ARNOLD CN NR BEND, OR",Deschutes
BCMO,14358800,"BEAR CR AB MOUTH NR CENTRAL POINT, OR",Rogue
BCTO,14357000,"BEAR CR BL PHOENIX CN NR TALENT, OR",Rogue
BENO,14064500,"DESCHUTES R AT BENHAM FALLS NR BEND, OR",Deschutes
BERO,13330500,"BEAR CR NR WALLOWA, OR",Grande Ronde
BIRO,14025000,"BIRCH CR AT RIETH, OR",Umatilla
BJBO,14357503,"BEAR CR AT JACKSON ST BRIDGE AT MEDFORD, OR",Rogue
BSCO,14335235,BIEBERSTEDT CR AB WILLOW LK NR BUTTE FALLS,Rogue
CENO,14066500,"CENTRAL OREGON CN AB PILOT BUTTE NR BEND, OR",Deschutes
CRAO,14054000,"DESCHUTES R BL CRANE PRAIRIE RES NR LA PINE, OR",Deschutes
CRCO,14080590,"CROOKED R FEED CN NR PRINEVILLE, OR",Deschutes
CREO,14060000,"CRESCENT CR AT CRESCENT LAKE NR CRESCENT, OR",Deschutes
CRPO,14079800,"CROOKED R AB PRINEVILLE RES NR POST, OR",Deschutes
CRSO,14087300,"CROOKED R NR TERREBONNE, OR",Deschutes
CSAO,14029780,"US ""A"" LINE CN AT COLD SPGS RES NR HERMISTON, OR",Umatilla
CSRO,14019110,"COLD SPRINGS RESERVOIR EXCHANGE CN NR HERMISTON, OR",Umatilla
DCMO,14068500,"DESCHUTES CTY MUN IMP DIST CN AT BEND, OR",Deschutes
DEBO,14070500,"DESCHUTES R BL BEND, OR",Deschutes
DLEO,14031000,"DILLON CN NR STANFIELD, OR",Umatilla
EGSO,14348400,"EMIGRANT CR AB GREEN SPRINGS POWERPLANT NR ASHLAND,",Rogue
FCEO,14029000,"UMATILLA PROJECT FEED CN NR ECHO, OR",Umatilla
FCSO,14029550,"UMATILLA PROJECT FEED CN AT RES NR HERMISTON, OR",Umatilla
FURO,14026897,"FURNISH CN AB CRAYNE-LISLE CN NR ECHO, OR",Umatilla
GALO,14204530,"GALES CR AT ROUTE 47 AT FOREST GROVE, OR",Willamette
GCCO,14358680,"GRIFFIN CR AT CENTRAL POINT, OR",Rogue
GCJO,14358610,GRIFFIN CR BL MURPHY CR NR MEDFORD,Rogue
GILO,14340800,"S FK LITTLE BUTTE CR AB SODA CR NR LAKECREEK, OR",Rogue
GSTO,14202510,"TUALATIN R AT GASTON, OR",Willamette
JCCO,14358750,"JACKSON CR AT CENTRAL POINT, OR",Rogue
JCJO,14358725,JACKSON CR AT JACKSONVILLE,Rogue
LAPO,14063000,"LITTLE DESCHUTES R NR LA PINE, OR",Deschutes
LBCO,14346700,"LITTLE BUTTE CR AT LAKECREEK, OR",Rogue
LBEO,14348000,"LITTLE BUTTE CR BL EAGLE POINT, OR",Rogue
LSTO,13330000,"LOSTINE R NR LOSTINE, OR",Grande Ronde
MABO,13216500,"N FK MALHEUR R AB BEULAH RES NR BEULAH, OR",Malheur
MAXO,14031500,"MAXWELL CN NR HERMISTON, OR",Umatilla
MCKO,14023500,"MCKAY CR NR PENDLETON, OR",Umatilla
MDCO,14363450,MCDONALD CR NR TALENT,Rogue
MLCO,14083400,"MILL CR BL SCHOOLHOUSE CR NR PRINEVILLE, OR",Deschutes
MYKO,14022500,"MCKAY CR NR PILOT ROCK, OR",Umatilla
NCAO,14069500,"NORTH CN NR BEND, OR",Deschutes
NCFO,14350900,"NEIL CR AB DUNN D NR ASHLAND, OR",Rogue
NFLO,14343000,"N FK LITTLE BUTTE CR NR LAKECREEK, OR",Rogue
NMCO,14069000,"NORTH UNIT MAIN CN NR BEND, OR",Deschutes
NPDO,13284900,"POWDER R AB THIEF VALLEY RES NR N POWDER, OR",Powder
OCHO,14085300,"OCHOCO CR BL OCHOCO RES NR PRINEVILLE, OR",Deschutes
OCRO,14082550,"OCHOCO CR BL MARKS CR NR PRINEVILLE, OR",Deschutes
PDTO,14021000,"UMATILLA R AT PENDLETON, OR",Umatilla
PRHO,13275105,"POWDER R AT HUDSPETH LANE NR SUMPTER, OR",Powder
PRVO,14080500,"CROOKED R NR PRINEVILLE, OR",Deschutes
PWDO,13277000,"POWDER R AT BAKER CITY, OR",Powder
SBCO,14095250,"MUD SPRINGS CR NR GATEWAY, OR",Deschutes
SCOO,14202980,"SCOGGINS CR BL HENRY HAGG LAKE NR GASTON, OR",Willamette
SFLO,14341610,"S FK LITTLE BUTTE CR AT MOUTH NR LAKECREEK, OR",Rogue
SILO,10390000,"SILVER CR NR SILVER LAKE, OR",Goose & Summer Lake
SPBO,11497500,"SPRAGUE R NR BEATTY, OR",Klamath
SQSO,14076050,"WHYCHUS CR AT SISTERS, OR",Deschutes
SWCO,14070000,"SWALLEY CN NR BEND, OR",Deschutes
TFCO,14073500,"TUMALO FEED CN NR BEND, OR",Deschutes
THF,13285500,"POWDER R BL THIEF VALLEY RES NR N POWDER, OR",Powder
TRGO,14095255,"TROUT CR AT CLEMENS DR NR GATEWAY, OR",Deschutes
TUMO,14073520,"TUMALO CR BL TUMALO FEED CN DIV NR BEND, OR",Deschutes
UMDO,14031050,"UMATILLA R AT I-84, NR STANFIELD, OR",Umatilla
UMMO,14031600,"UMATILLA R BL MAXWELL CN NR HERMISTON, OR",Umatilla
UMTO,14032400,UMATILLA R BL WASTE WATER TREATMENT PLANT NR HERMIS,Umatilla
UMUO,14029900,"UMATILLA R NR ECHO, OR",Umatilla
WBCO,14024100,"W BIRCH CR AT PILOT ROCK, OR",Umatilla
WCAO,14335230,WILLOW CR AB WILLOW LK NR BUTTE FALLS,Rogue
WCBO,14335300,"WILLOW CR NR BUTTE FALLS, OR",Rogue
WCDO,14335250,"WILLOW CR DAM OUTLET NR BUTTE FALLS, OR",Rogue
WCGO,14354950,WAGNER CR BL GOOSE CR NR TALENT,Rogue
WCRO,14020990,"WILDHORSE CR AT PENDLETON, OR",Umatilla
WESO,14030500,"WESTERN LAND CN NR ECHO, OR",Umatilla
WEUO,14032500,"W DIVISION MAIN CN NR UMATILLA, OR",Umatilla
WICO,14056500,"DESCHUTES R BL WICKIUP RES NR LA PINE, OR",Deschutes
YOKO,14026000,"UMATILLA R AT YOAKUM, OR",Umatilla
,14372300,"ROGUE R NR AGNESS, OR",Rogue
,14361900,"APPLEGATE LAKE NR COPPER, OR",Rogue
,14362000,"APPLEGATE R NR COPPER, OR",Rogue
,14366000,"APPLEGATE R NR APPLEGATE, OR",Rogue
,13290450,"SNAKE R AT HELLS CAN DAM ID-OR STATE LINE, OR",Out of State-Part 13
,14048000,"JOHN DAY R AT MCDONALD FERRY, OR",John Day
,14359000,"ROGUE R AT RAYGOLD NR CENTRAL PT, OR",Rogue
,13290460,"SNAKE R AT JOHNSON BAR ID-OR STATE LINE, WA",Powder
,14105700,"COLUMBIA R AT THE DALLES, OR",Out of State-Part 14
,13214500,"WARMSPRINGS RES NR RIVERSIDE, OR",Malheur
,14056000,"WICKIUP RES NR LA PINE, OR",Deschutes
,14335240,"WILLOW CR RES NR BUTTE FALLS, OR",Rogue
,14354200,"BEAR CR BL ASHLAND CR AT ASHLAND, OR",Rogue
,13217500,"N FK MALHEUR AT BEULAH, OR",Malheur
,14087400,"CROOKED R BL OPAL SPRINGS NR CULVER, OR",Deschutes
,14076500,"DESCHUTES R NR CULVER, OR",Deschutes
,14203500,"TUALATIN R NR DILLEY, OR",Willamette
,14339000,"ROGUE R AT DODGE BR NR EAGLE POINT, OR",Rogue
,14361500,"ROGUE R AT GRANTS PASS, OR",Rogue
,13292000,"IMNAHA R AT IMNAHA, OR",Grande Ronde
,14357500,"BEAR CR AT MEDFORD, OR",Rogue
,13183000,"OWYHEE R BL OWYHEE DAM, OR",Owyhee
,13181000,"OWYHEE R NR ROME, OR",Owyhee
,13213100,"SNAKE R AT NYSSA, OR",Out of State-Part 13
,13333000,"GRANDE RONDE R AT TROY, OR",Grande Ronde
,14033500,"UMATILLA R NR UMATILLA, OR",Umatilla
,13233300,"MALHEUR R BL NEVADA DAM NR VALE, OR",Malheur
,13215000,"MALHEUR R BL WARMSPRINGS RES NR RIVERSIDE, OR",Malheur
,14207500,"TUALATIN R AT WEST LINN, OR",Willamette
,10366000,"TWENTYMILE CR NR ADEL, OR",Goose & Summer Lake
,10371500,"DEEP CR AB ADEL, OR",Goose & Summer Lake
,10378500,"HONEY CR NR PLUSH, OR",Goose & Summer Lake
,10384000,"CHEWAUCAN R NR PAISLEY, OR",Goose & Summer Lake
,10388800,"THOMPSON VALLEY RES NR SILVER LAKE, OR",Goose & Summer Lake
,10393500,"SILVIES R NR BURNS, OR",Malheur Lake
,10396000,"DONNER UND BLITZEN R NR FRENCHGLEN, OR",Malheur Lake
,10403400,SILVER CR BL NICOLL CR NR RILEY,Malheur Lake
,10406500,"TROUT CR NR DENIO, NV",Malheur Lake
,11338500,"DREWS RES NR LAKEVIEW, OR",Goose & Summer Lake
,11339995,"COTTONWOOD CR AB COTTONWOOD RES NR LAKEVIEW, OR",Goose & Summer Lake
,11340695,"COTTONWOOD CR BL N DREWS CN NR LAKEVIEW, OR",Goose & Summer Lake
,11484200,LOST R AT BONANZA,Klamath
,11484201,BONANZA BIG SPRINGS PARK (GW-SW),Klamath
,11491400,"WILLIAMSON R BL SHEEP CR NR LENZ, OR",Klamath
,11493500,"WILLIAMSON R NR KLAMATH AGENCY, OR",Klamath
,11494950,S FK SPRAGUE R AT SPRAGUE R PARK NR BLY,Klamath
,11495600,S FK SPRAGUE R BL FISHHOLE CR NR BLY,Klamath
,11495900,"N FK SPRAGUE R AB SRIC CN NR BLY, OR",Klamath
,11497550,SPRAGUE R BL BROWN CR NR BEATTY,Klamath
,11499100,"SYCAN R BL SNAKE CR NR BEATTY, OR",Klamath
,11500500,SPRAGUE R AT LONE PINE,Klamath
,11501000,"SPRAGUE R NR CHILOQUIN, OR",Klamath
,11502500,"WILLIAMSON R BL SPRAGUE R NR CHILOQUIN, OR",Klamath
,11502940,"WOOD R AT DIXON RD NR FORT KLAMATH, OR",Klamath
,11504500,"FOURMILE LAKE NR RECREATION, OR",Klamath
,11505800,"UPPER KLAMATH LAKE AT ROCKY POINT, OR",Klamath
,11505900,"UPPER KLAMATH LAKE AT RATTLESNAKE POINT, OR",Klamath
,11507000,"UPPER KLAMATH LAKE NR KLAMATH FALLS, OR",Klamath
,11507001,UPPER KLAMATH LAKE DAILY WEIGHTED MEAN ELEVATIONS,Klamath
,11507500,"LINK R AT KLAMATH FALLS, OR",Klamath
,11509340,KLAMATH STRAITS DRAIN NEAR WORDEN,Klamath
,11509500,"KLAMATH R AT KENO, OR",Klamath
,11510000,"SPENCER CR NR KENO, OR",Klamath
,11510700,"KLAMATH R BL JOHN CR BOYLE PP NR KENO, OR",Klamath
,11516530,"KLAMATH R BL IRON GATE DAM, CA",Out of State-Part 11
,13214000,"MALHEUR R NR DREWSEY, OR",Malheur
,13273000,"BURNT R NR HEREFORD, OR",Powder
,13274020,"BURNT R AB CLARKS CR NR BRIDGEPORT, OR",Powder
,13275000,"BURNT R AT HUNTINGTON, OR",Powder
,13275300,"POWDER R NR SUMPTER, OR",Powder
,13281200,"ROCK CR NR HAINES, OR",Powder
,13282550,"N POWDER R BL ANTHONY FK NR N POWDER, OR",Powder
,13317850,"GRANDE RONDE R BL CLEAR CR, NR STARKEY, OR",Grande Ronde
,13318210,"MEADOW CR BL DARK CANYON CR NR STARKEY, OR",Grande Ronde
,13318960,"GRANDE RONDE R NR PERRY, OR",Grande Ronde
,13320000,"CATHERINE CR NR UNION, OR",Grande Ronde
,13320300,"CATHERINE CR AT UNION, OR",Grande Ronde
,13329765,"WALLOWA R NR ENTERPRISE, OR",Grande Ronde
,13330300,"LOSTINE R AT BAKER RD, NR LOSTINE, OR",Grande Ronde
,13331450,"WALLOWA R BL WATER CAN, NR WALLOWA, OR",Grande Ronde
,13331500,"MINAM R NR MINAM, OR",Grande Ronde
,14010800,"N FK WALLA WALLA R NR MILTON FREEWATER, OR",Umatilla
,14012100,"LITTLE WALLA WALLA R NR MILTON, OR",Umatilla
,14012300,"MILTON-FREEWATER HUDSON BAY D NR FREEWATER, OR",Umatilla
,14013000,"MILL CR NR WALLA WALLA, WA",Out of State-Part 14
,14015000,"MILL CR AT WALLA WALLA, WA",Out of State-Part 14
,14018500,"WALLA WALLA R NR TOUCHET, WA",Out of State-Part 14
,14019109,"COLUMBIA EXCHANGE CN NR HERMISTON, OR",Umatilla
,14020000,"UMATILLA R AB MEACHAM CR NR GIBBON, OR",Umatilla
,14020300,"MEACHAM CR AT GIBBON, OR",Umatilla
,14020850,"UMATILLA R AT W RESERV BOUNDARY NR PENDLETON, OR",Umatilla
,14024300,"E BIRCH CR AT PILOT ROCK, OR",Umatilla
,14030820,"ORDNANCE RECHARGE CN NR ORDNANCE, OR",Umatilla
,14032000,"BUTTER CR NR PINE CITY, OR",Umatilla
,14032450,UMATILLA R AT THREE-MILE DAM NR UMATILLA,Umatilla
,14032650,"W DIVISION MAIN CN BL POWERLINE RD NR UMATILLA, OR",Umatilla
,14034470,"WILLOW CR AB WILLOW CR LAKE, NR HEPPNER, OR",Umatilla
,14034500,"WILLOW CR AT HEPPNER, OR",Umatilla
,14034608,"WILLOW CR AT MORGAN STREET, AT HEPPNER",Umatilla
,14034800,"RHEA CR NR HEPPNER, OR",Umatilla
,14036860,"JOHN DAY R AT BLUE MTN HOT SPRINGS NR PRA CITY, OR",John Day
,14037500,"STRAWBERRY CR AB SLIDE CR NR PRAIRIE CITY, OR",John Day
,14038530,"JOHN DAY R NR JOHN DAY, OR",John Day
,14038602,"CANYON CR NR CANYON CITY, OR",John Day
,14039320,"S FK JOHN DAY R AB DRY PINE CR NR IZEE, OR",John Day
,14039340,"DEER CR NR IZEE, OR",John Day
,14039380,"MURDERERS CR NR DAYVILLE, OR",John Day
,14039500,"S FK JOHN DAY R NR DAYVILLE, OR",John Day
,14040500,"JOHN DAY R AT PICTURE GORGE, NR DAYVILLE, OR",John Day
,14040600,"MOUNTAIN CR NR MITCHELL, OR",John Day
,14042500,"CAMAS CR NR UKIAH, OR",John Day
,14043700,"FIVEMILE CR DIV TO BUTTER CR NR GURDANE, OR",John Day
,14043840,M FK JOHN DAY R AB CAMP CR NR GALENA,John Day
,14044000,"M FK JOHN DAY R AT RITTER, OR",John Day
,14046000,"N FK JOHN DAY R AT MONUMENT, OR",John Day
,14046500,"JOHN DAY R AT SERVICE CR, OR",John Day
,14046778,"BRIDGE CR AB COYOTE CAN NR MITCHELL, OR",John Day
,14046890,"PINE CR NR CLARNO, OR",John Day
,14047100,"BUTTE CR NR FOSSIL, OR",John Day
,14050000,"DESCHUTES R BL SNOW CR NR LA PINE, OR",Deschutes
,14051000,"CULTUS CR AB CRANE PRAIRIE RES NR LA PINE, OR",Deschutes
,14055600,"ODELL CR NR LA PINE, OR",Deschutes
,14062500,"WALKER BASIN CN NR LA PINE, OR",Deschutes
,14074900,"SNOW CR NR SISTERS, OR",Deschutes
,14075000,"WHYCHUS CR NR SISTERS, OR",Deschutes
,14085100,"OCHOCO RES NR PRINEVILLE, OR",Deschutes
,14087380,"CROOKED R BL OSBORNE CAN, NR OPAL CITY,, OR",Deschutes
,14088500,"METOLIUS R AT ALLINGHAM RS NR SISTERS, OR",Deschutes
,14090350,"JEFFERSON CR NR CAMP SHERMAN, OR",Deschutes
,14090400,"WHITEWATER R NR CAMP SHERMAN, OR",Deschutes
,14091500,"METOLIUS R NR GRANDVIEW, OR",Deschutes
,14092500,"DESCHUTES R NR MADRAS, OR",Deschutes
,14092750,"SHITIKE CR AT PETERS PASTURE NR WARM SPRINGS, OR",Deschutes
,14093000,"SHITIKE CR AT WARM SPRINGS, OR",Deschutes
,14095500,"WARM SPRINGS R NR SIMNASHO, OR",Deschutes
,14096300,"MILL CR NR BADGER BUTTE NR WARM SPRINGS, OR",Deschutes
,14096850,"BEAVER CR BL QUARTZ CR NR SIMNASHO, OR",Deschutes
,14097100,"WARM SPRINGS R NR KAHNEETA HOT SPRINGS, OR",Deschutes
,14103000,"DESCHUTES R AT MOODY NR BIGGS, OR",Deschutes
,14104800,FIFTEENMILE CR AT KASER RANCH NR THE DALLES,Hood
,14105550,FIFTEENMILE CR NR THE DALLES,Hood
,14113200,"MOSIER CR NR MOSIER, OR",Hood
,14114000,"E FK I D CN NR MT HOOD, OR",Hood
,14116195,DEE IRRIGATION CN AB CAMP CR NR DEE,Hood
,14118500,"W FK HOOD R NR DEE, OR",Hood
,14120000,"HOOD R AT TUCKER BRIDGE NR HOOD R, OR",Hood
,14123500,"WHITE SALMON R NR UNDERWOOD, WA",Out of State-Part 14
,14128870,"COLUMBIA R BL BONNVILLE DAM, OR",Out of State-Part 14
,14134000,"SALMON R NR GOVERNMENT CAMP, OR",Sandy
,14137000,"SANDY R NR MARMOT, OR",Sandy
,14138720,"BULL RUN R AT LOWER FLUME NR BRIGHTWOOD, OR",Sandy
,14138800,"BLAZED ALDER CR NR RHODODENDRON, OR",Sandy
,14138850,"BULL RUN R NR MULTNOMAH FALLS, OR",Sandy
,14138870,"FIR CR NR BRIGHTWOOD, OR",Sandy
,14138900,"N FK BULL RUN R NR MULTNOMAH FALLS, OR",Sandy
,14139800,"S FK BULL RUN R NR BULL RUN, OR",Sandy
,14140000,"BULL RUN R NR BULL RUN (RIVER ONLY), OR",Sandy
,14141500,"LITTLE SANDY R NR BULL RUN, OR",Sandy
,14142500,"SANDY R BL BULL RUN R, NR BULL RUN, OR",Sandy
,14142800,"BEAVER CR AT TROUTDALE, OR",Sandy
,14144700,"COLUMBIA R AT VANCOUVER, WA",Out of State-Part 14
,14145500,"M FK WILLAMETTE R AB SALT CR, NR OAKRIDGE, OR",Willamette
,14148000,"M FK WILLAMETTE R BL N FK NR OAKRIDGE, OR",Willamette
,14150000,"M FK WILLAMETTE R NR DEXTER, OR",Willamette
,14150290,"FALL CREEK ABOVE NORTH FORK, NEAR LOWELL",Willamette
,14150800,"WINBERRY CR NR LOWELL, OR",Willamette
,14151000,"FALL CR BL WINBERRY CR NR FALL CR, OR",Willamette
,14152000,"M FK WILLAMETTE R AT JASPER, OR",Willamette
,14153500,"COAST FK WILLAMETTE R BL COTTAGE GR DAM, OR",Willamette
,14154500,"ROW R AB PITCHER CR NR DORENA, OR",Willamette
,14155500,"ROW R NR COTTAGE GROVE, OR",Willamette
,14157500,"COAST FK WILLAMETTE R NR GOSHEN, OR",Willamette
,14158500,"MCKENZIE R AT OUTLET OF CLEAR LAKE, OR",Willamette
,14158850,"MCKENZIE R BL TRAIL BR DAM NR BELKNAP SPRINGS, OR",Willamette
,14159110,"MCKENZIE R AB S FK, NR RAINBOW, OR",Willamette
,14159200,"S FK MCKENZIE R AB COUGAR LAKE NR RAINBOW, OR",Willamette
,14159500,"S FK MCKENZIE R NR RAINBOW, OR",Willamette
,14161500,"LOOKOUT CR NR BLUE R, OR",Willamette
,14162200,"BLUE R AT BLUE R, OR",Willamette
,14162500,"MCKENZIE R NR VIDA, OR",Willamette
,14163150,"MCKENZIE R BL LEABURG DAM, NR LEABURG, OR",Willamette
,14163900,"MCKENZIE R NR WALTERVILLE, OR",Willamette
,14164550,"CAMP CR AT CAMP CR RD BRIDGE, NR SPRINGFIELD, OR",Willamette
,14164700,"CEDAR CR AT SPRINGFIELD, OR",Willamette
,14164900,"MCKENZIE R AB HAYDEN BR AT SPRINGFIELD, OR",Willamette
,14165000,"MOHAWK R NR SPRINGFIELD, OR",Willamette
,14165500,"MCKENZIE R NR COBURG, OR",Willamette
,14166000,"WILLAMETTE R AT HARRISBURG, OR",Willamette
,14166500,"LONG TOM R NR NOTI, OR",Willamette
,14169000,"LONG TOM R NR ALVADOR, OR",Willamette
,14170000,"LONG TOM R AT MONROE, OR",Willamette
,14171000,"MARYS R NR PHILOMATH, OR",Willamette
,14171600,WILLAMETTE R AT CORVALLIS,Willamette
,14174000,"WILLAMETTE R AT ALBANY, OR",Willamette
,14178000,"N SANTIAM R BL BOULDER CR NR DETROIT, OR",Willamette
,14179000,"BREITENBUSH R AB FRENCH CR NR DETROIT, OR",Willamette
,14180300,"BLOWOUT CR NR DETROIT, OR",Willamette
,14181500,"N SANTIAM R AT NIAGARA, OR",Willamette
,14181900,"LITTLE N SANTIAM R AB EVANS CR NR GATES, OR",Willamette
,14182500,"LITTLE N SANTIAM R NR MEHAMA, OR",Willamette
,14183000,"N SANTIAM R AT MEHAMA, OR",Willamette
,14184100,"N SANTIAM R NR JEFFERSON, OR",Willamette
,14185000,"S SANTIAM R BL CASCADIA, OR",Willamette
,14185800,"M SANTIAM R NR CASCADIA, OR",Willamette
,14185900,"QUARTZVILLE CR NR CASCADIA, OR",Willamette
,14186200,"M SANTIAM R BL GREEN PETER LAKE NR FOSTER, OR",Willamette
,14187000,"WILEY CR NR FOSTER, OR",Willamette
,14187200,"S SANTIAM R NR FOSTER, OR",Willamette
,14187500,"S SANTIAM R AT WATERLOO, OR",Willamette
,14187600,"LEBANON SANTIAM CN NR LEBANON, OR",Willamette
,14188610,"SCHAFER CR NR LACOMB, OR",Willamette
,14188800,"THOMAS CR NR SCIO, OR",Willamette
,14189000,"SANTIAM R AT JEFFERSON, OR",Willamette
,14190500,"LUCKIAMUTE R NR SUVER, OR",Willamette
,14191000,"WILLAMETTE R AT SALEM, OR",Willamette
,14192500,"S YAMHILL R NR WILLAMINA, OR",Willamette
,14193000,"WILLAMINA CR NR WILLAMINA, OR",Willamette
,14194150,"S YAMHILL R AT MCMINNVILLE, OR",Willamette
,14194300,"N YAMHILL R NR FAIRDALE, OR",Willamette
,14196000,"HASKINS CR BEL RESER NR MCMINNVILLE, OR",Willamette
,14197900,"WILLAMETTE R AT NEWBERG, OR",Willamette
,14198400,"BULL CR NR WILHOIT, OR",Willamette
,14199704,"NATE CR TRIB NR COLTON, OR",Willamette
,14200000,"MOLALLA R NR CANBY, OR",Willamette
,14201300,"ZOLLNER CR NR MT ANGEL, OR",Willamette
,14201340,"PUDDING R NR WOODBURN, OR",Willamette
,14202000,"PUDDING R AT AURORA, OR",Willamette
,14202450,"TUALATIN R BL LEE FALLS NR CHERRY GROVE, OR",Willamette
,14202550,"AYERS CR AT NE NORTH VALLEY RD, NR GASTON, OR",Willamette
,14202630,"WAPATO CN AT PUMPHOUSE, AT GASTON",Willamette
,14202650,"WAPATO CR AT SW GASTON RD, AT GASTON, OR",Willamette
,14202850,"SCOGGINS CR AB HENRY HAGG LAKE NR GASTON, OR",Willamette
,14204800,"TUALATIN R AT GOLF COURSE RD NR CORNELIUS, OR",Willamette
,14205400,"E FK DAIRY CR NR MEACHAM CORNER, OR",Willamette
,14206200,"DAIRY CR AT RTE 8 NR HILLSBORO, OR",Willamette
,14206295,"TUALATIN R AT ROOD BRIDGE AT HILLSBORO, OR",Willamette
,14206900,"FANNO CR AT 56TH AVE, AT PORTLAND, OR",Willamette
,14206950,"FANNO CR AT DURHAM, OR",Willamette
,14206956,"TUALATIN R AT TUALATIN PARK NR TUALATIN, OR",Willamette
,14207740,"WILLAMETTE R AB FALLS AT OREGON CITY, OR",Willamette
,14207770,"WILLAMETTE R BL FALLS AT OREGON CITY, OR",Willamette
,14208700,"OAK GROVE FK NR GOVERNMENT CAMP, OR",Willamette
,14209000,"OAK GROVE FK AB POWERPLANT INTAKE, OR",Willamette
,14209500,"CLACKAMAS R AB THREE LYNX CR, OR",Willamette
,14210000,"CLACKAMAS R AT ESTACADA, OR",Willamette
,14211010,"CLACKAMAS R NR OREGON CITY, OR",Willamette
,14211315,"TRYON CR BL NETTLE CR, NR LAKE OSWEGO, OR",Willamette
,14211400,"JOHNSON CR AT REGNER RD AT GRESHAM, OR",Willamette
,14211499,"KELLEY CR AT SE 159TH DRIVE AT PORTLAND, OR",Willamette
,14211500,"JOHNSON CR AT SYCAMORE, OR",Willamette
,14211550,"JOHNSON CR AT MILWAUKIE, OR",Willamette
,14211720,"WILLAMETTE R AT PORTLAND, OR",Willamette
,14211814,"FAIRVIEW CR AT GLISAN ST NR GRESHAM, OR",Willamette
,14211820,"COLUMBIA SL AT PORTLAND, OR",Willamette
,14246900,"COLUMBIA R AT BEAVER ARMY TERMINAL NR QUINCY, OR",Out of State-Part 14
,14299800,"NEHALEM R NR VERNONIA, OR",North Coast
,14301000,"NEHALEM R NR FOSS, OR",North Coast
,14301500,"WILSON R NR TILLAMOOK, OR",North Coast
,14302020,"WILSON R AT SOLLIE SMITH BR, AT TILLAMOOK, OR",North Coast
,14302480,"TRASK R AB CEDAR CR NR TILLAMOOK, OR",North Coast
,14302900,"NESTUCCA R NR FAIRDALE, OR",North Coast
,14303200,"TUCCA CR NR BLAINE, OR",North Coast
,14303600,"NESTUCCA R NR BEAVER, OR",North Coast
,14304350,"SUNSHINE CR NR VALSETZ, OR",Middle Coast
,14305500,"SILETZ R AT SILETZ, OR",Middle Coast
,14306030,"YAQUINA R NR CHITWOOD, OR",Middle Coast
,14306340,"E FK LOBSTER CR NR ALSEA, OR",Middle Coast
,14306500,"ALSEA R NR TIDEWATER, OR",Middle Coast
,14306872,YACHATS R AB CLEAR CR NR YACHATS,Middle Coast
,14307620,"SIUSLAW R NR MAPLETON, OR",Middle Coast
,14308000,"S UMPQUA R AT TILLER, OR",Umpqua
,14308500,"ELK CR NR DREW, OR",Umpqua
,14308990,"COW CR AB GALESVILLE RES, NR AZALEA, OR",Umpqua
,14308995,"GALESVILLE RES NR AZALEA, OR",Umpqua
,14309000,"COW CR NR AZALEA, OR",Umpqua
,14309500,"W FK COW CR NR GLENDALE, OR",Umpqua
,14310000,"COW CR NR RIDDLE, OR",Umpqua
,14312000,"S UMPQUA R NR BROCKWAY, OR",Umpqua
,14312500,"LAKE CR NR DIAMOND LAKE, OR",Umpqua
,14313200,"NUMPQUA R AB WHITE MULE CK, NR TOKETEE FALLS,, OR",Umpqua
,14313500,"N UMPQUA R BL LEMOLO LAKE NR TOKETEE FALLS, OR",Umpqua
,14313700,"NUMPQUA R BL WARM SPRINGS CR NR TOKETEE FALLS,, OR",Umpqua
,14314500,"CLEARWATER R AB TRAP CR NR TOKETEE FALLS, OR",Umpqua
,14314700,"CLEARWATER R BL MOWICH CR, NR TOKETEE FALLS,, OR",Umpqua
,14315500,"N UMPQUA R AT TOKETEE FALLS, OR",Umpqua
,14315950,"FISH CR AB SLIPPER CR NR TOKETEE FALLS, O, OR",Umpqua
,14316455,"N.UMPQUA R BLW SODA SPGS RESV, NR TOKETEE FALLS,",Umpqua
,14316495,"BOULDER CR NR TOKETEE FALLS, OR",Umpqua
,14316500,"N UMPQUA R AB COPELAND CR NR TOKETEE FALLS, OR",Umpqua
,14316700,"STEAMBOAT CR NR GLIDE, OR",Umpqua
,14318000,"LITTLE R AT PEEL, OR",Umpqua
,14319500,"N UMPQUA R AT WINCHESTER, OR",Umpqua
,14319830,"S FK HINKLE CR NR NONPAREIL, OR",Umpqua
,14319835,"N FK HINKLE CR NR NONPAREIL, OR",Umpqua
,14320700,"CALAPOOYA CR NR OAKLAND, OR",Umpqua
,14320934,LITTLE WOLF CR NR TYEE,Umpqua
,14321000,"UMPQUA R NR ELKTON, OR",Umpqua
,14325000,"S FK COQUILLE R AT POWERS, OR",South Coast
,14326510,"S FK COQUILLE R AT MYRTLE POINT, OR",South Coast
,14327000,"N FK COQUILLE R NR MYRTLE POINT, OR",South Coast
,14327137,"FLORAS CR NR LANGLOIS, OR",South Coast
,14330000,"ROGUE R BL PROSPECT, OR",Rogue
,14332000,"S FK ROGUE R NR PROSPECT, OR",Rogue
,14335072,"ROGUE R AT COLE M RIVERS F HATCHERY NR MCLEOD, OR",Rogue
,14335200,S FK BIG BUTTE CR AB WILLOW CR NR BUTTE FALLS,Rogue
,14337500,"BIG BUTTE CR NR MCLEOD, OR",Rogue
,14337600,"ROGUE R NR MCLEOD, OR",Rogue
,14338000,"ELK CR NR TRAIL, OR",Rogue
,14342500,"N FK LITTLE BUTTE CR AT FISH LAKE NR LAKECREEK, OR",Rogue
,14348150,"ANTELOPE CR NR EAGLE POINT, OR",Rogue
,14352000,"NEIL CR AT MOUTH NR ASHLAND, OR",Rogue
,14352001,"BEAR CR BL NEAL CR NR ASHLAND, OR",Rogue
,14353000,"W FK ASHLAND CR NR ASHLAND, OR",Rogue
,14353500,"E FK ASHLAND CR NR ASHLAND, OR",Rogue
,14354100,"ASHLAND CR BL TREATMENT PLANT AT ASHLAND, OR",Rogue
,14355875,"WAGNER CR AT TALENT, OR",Rogue
,14360500,"EVANS CR AT WIMER, OR",Rogue
,14362250,"STAR G NR RUCH, OR",Rogue
,14365500,"L APPLEGATE R NR RUCH, OR",Rogue
,14369500,"APPLEGATE R NR WILDERVILLE, OR",Rogue
,14372500,"E FK ILLINOIS R NR TAKILMA, OR",Rogue
,14375100,"SUCKER CR BL L GRAYBACK CR NR HOLLAND, OR",Rogue
,14375200,"SUCKER CR AT BRIDGEVIEW, OR",Rogue
,14377100,"ILLINOIS R NR KERBY, OR",Rogue
,14400000,"CHETCO R NR BROOKINGS, OR",South Coast
,14076000A,WHYCHUS CR CN #1 NR SISTERS,Deschutes
